sentence,entities,country_entities
"Eastern Poland  incorporated into the Byelorussian SSR and the Ukrainian SSR ,  189  Latvia which became the Latvian SSR , Estonia which became the Estonian SSR , Lithuania  which became the Lithuanian SSR ,  190  part of eastern Finland which became the KareloFinnish SSR   191  and eastern Romania part of which became the Moldavian SSR   192  were now wholly part of Soviet Union.","['Eastern Poland', '189', 'Latvia', 'the Latvian SSR', 'Estonia', 'Estonian', 'Lithuania', 'the Lithuanian SSR', '190', 'Finland', '191', 'Romania', 'Moldavian', '192', 'Soviet Union']","['Latvia', 'Estonia', 'Lithuania', 'Finland', 'Romania']"
"Furthermore, between 1945 and 1949, Yugoslavia , Albania , Bulgaria , Poland , Romania , Czechoslovakia , Hungary and East Germany saw communist regimes coming to power and their transformation into Peoples Republics .  ","['between 1945 and 1949', 'Yugoslavia', 'Albania', 'Bulgaria', 'Poland', 'Romania', 'Czechoslovakia', 'Hungary', 'East Germany', 'Peoples Republics']","['Albania', 'Bulgaria', 'Poland', 'Romania', 'Hungary']"
"Outside of Europe, countries that would see the rise of communism and would ally themselves to the communist bloc include Mongolia , China, North Korea , Cuba and Vietnam .  ","['Europe', 'communist', 'Mongolia', 'China', 'North Korea', 'Cuba', 'Vietnam']","['Mongolia', 'Cuba', 'Vietnam']"
"200  General Douglas MacArthur led troops from the United States, Canada, Australia, Great Britain, and other countries in repulsing the Northern invasion.","['200', 'Douglas MacArthur', 'the United States', 'Canada', 'Australia', 'Great Britain']","['Canada', 'Australia']"
"After the French withdrawal from its former colony, on 21 July 1954, Vietnam became partitioned into two halves, much like Korea, along the 17th parallel .","['French', '21 July 1954', 'Vietnam', 'two', 'Korea', 'the 17th']",['Vietnam']
"The plan went awry, with Nixon  deliberately sabotaging peace talks for political gain,  207  and the war spilled into neighboring Cambodia while South Vietnamese forces were pushed further back.  ","['Nixon', '207', 'Cambodia', 'South Vietnamese']",['Cambodia']
"Saigon was captured on 30 April 1975, and Vietnam was unified under Communist rule a year later, effectively bringing an end to one of the most unpopular wars of all time.  210   211  The Cuban Missile Crisis illustrates just how close to the brink of nuclear war the world came during the Cold War .","['Saigon', '30 April 1975', 'Vietnam', 'Communist', 'a year later', 'one', '210', '211', 'The Cuban Missile Crisis', 'the Cold War']",['Vietnam']
"Cuba , under Fidel Castro s socialist government, had formed close ties with the Soviet Union .  ","['Cuba', 'Fidel Castro', 'the Soviet Union']",['Cuba']
"Main article Space Race With Cold War tensions running high, the Soviet Union and United States took their rivalry to the stars in 1957 with the Soviet launch of Sputnik .  ","['Cold War', 'the Soviet Union', 'United States', '1957', 'Soviet', 'Sputnik']",['United States']
"In the 1990s, work on the International Space Station began, and by the end of the century, while still incomplete, it was in continual use by astronauts from the United States, Europe, Russia, Japan, and Canada.  ","['the 1990s', 'the International Space Station', 'the end of the century', 'the United States', 'Europe', 'Russia', 'Japan', 'Canada']","['Russia', 'Japan', 'Canada']"
"Mikhail Gorbachev , its last leader, attempted to reform the country with glasnost and perestroika ,  230  but the formation of Solidarity ,  231  the fall of the Berlin Wall ,  232  and the breakingoff of several Soviet republics, such as Lithuania ,  233  started a slippery slope of events that culminated in a coup to overthrow Gorbachev, organized by Communist Party hardliners.","['Mikhail Gorbachev', '230', 'Solidarity', '231', 'the Berlin Wall', '232', 'Soviet', 'Lithuania', '233', 'Gorbachev', 'Communist Party']",['Lithuania']
"Boris Yeltsin , president of Russia, organized mass opposition, and the coup failed.  ","['Boris Yeltsin', 'Russia']",['Russia']
"267  The influence of China and India was also rising, as the worlds largest populations, long marginalized by the West and by their rulers, were rapidly integrating with the world economy.  ","['267', 'China', 'India', 'West']",['India']
"Meanwhile in South Africa , the apartheid came to an end and Nelson Mandela became the nations first black president, leading to the formation of a new democratic government, after having been ruled for four and a half decades of systemised racial segregation.","['South Africa', 'Nelson Mandela', 'first', 'four and a half decades']",['South Africa']
"In Rwanda , an estimated one million people were massacred in the genocide , which included targets of Tutsis and moderate Hutu and Twa people .","['Rwanda', 'an estimated one million', 'Tutsis', 'Hutu']",['Rwanda']
Hitler announces an Anschluss with Austria .,"['Hitler', 'Anschluss', 'Austria']",['Austria']
BBC  History  World Wars Invasion of Poland .,"['BBC', 'Poland']",['Poland']
Winter War Russia Invades Finland .,"['Winter War', 'Finland']",['Finland']
Why Finland allied itself with Nazi Germany  Letter .,"['Finland', 'Nazi Germany  Letter']",['Finland']
Germanys Invasion of Denmark and Norway.,"['Germanys Invasion of Denmark', 'Norway']",['Norway']
France to surrender .,['France'],['France']
Italy a burden on Hitler in World War II  World  Dunya News .,"['Italy', 'Hitler', 'World War II', 'Dunya News']",['Italy']
Italy Tried to Invade Greece in World War II.,"['Italy Tried', 'Greece', 'World War II']",['Greece']
Germany declares war on the United States .,"['Germany', 'the United States']",['Germany']
75 Years Ago The US Invasion of Italy .,['Italy'],['Italy']
"The Avalon Project Summary of the ThreePower Pact Between Germany, Italy, and Japan, Signed at Berlin, September 27, 1940 .","['The Avalon Project Summary', 'the ThreePower Pact Between Germany', 'Italy', 'Japan', 'Berlin', 'September 27, 1940']","['Italy', 'Japan']"
The Forgotten Reason Why Japan Attacked Pearl Harbor .,"['Japan', 'Pearl Harbor']",['Japan']
The United States declares war on Japan .,"['The United States', 'Japan']",['Japan']
From the Jaws of Death MacArthurs Escape from the Philippines .,"['the Jaws of Death MacArthurs Escape', 'Philippines']",['Philippines']
"Gutman, Israel 1990.","['Gutman', 'Israel', '1990']",['Israel']
Major milestones of Irans nuclear programme  Iran  Al Jazeera .,"['Irans', 'Iran', 'Al Jazeera']",['Iran']
The division of Germany  The Cold War 19451989  CVCE Website .,"['Germany', 'The Cold War 19451989', 'CVCE Website']",['Germany']
The forgotten violence that helped India break free from colonial rule .,['India'],['India']
Indian Independence Day everything you need to know about Partition between India and Pakistan 70 years on .,"['Indian', 'Partition between India', 'Pakistan', '70 years']",['Pakistan']
"The Philippines, 18981946  US House of Representatives History, Art  Archives .","['Philippines', '18981946', 'US House of Representatives History', 'Art  Archives']",['Philippines']
"The Moldovans Romania, Russia, and the Politics of Culture .","['Moldovans', 'Romania', 'Russia', 'the Politics of Culture']","['Romania', 'Russia']"
Selling Operation Passage to Freedom Dr. Thomas Dooley and the Religious Overtones of Early American Involvement in Vietnam .,"['Thomas Dooley', 'the Religious Overtones of Early American Involvement', 'Vietnam']",['Vietnam']
"Stuck in Endless Preliminaries Vietnam and the Battle of the Paris Peace Table, November 1968  January 1969 .","['Vietnam', 'the Battle of the Paris Peace Table', 'November 1968  January 1969']",['Vietnam']
AntiAmerican Behavior in the Middle East Evidence from a Field Experiment in Lebanon .,"['AntiAmerican Behavior', 'the Middle East', 'a Field Experiment', 'Lebanon']",['Lebanon']
The Rise of China and India A New Asian Drama .,"['India', 'New Asian']",['India']
