sentence,entities,country_entities
"After a period of diplomatic and military escalation known as the July Crisis , by the end of July 1914 two coalitions were at war the Allies, comprised initially of the British Empire , France , and the Russian Empire  and the Central Powers , comprised initially of the German Empire and AustriaHungary .  ","['the July Crisis', 'the end of July 1914', 'the British Empire', 'France', 'the Russian Empire', 'the Central Powers', 'the German Empire', 'AustriaHungary']",['France']
"1   2  In 1917, Russia ended hostile actions against the Central Powers after the fall of the Tsar.","['1', '1917', 'Russia', 'the Central Powers', 'Tsar']",['Russia']
"The Bolsheviks negotiated the Treaty of BrestLitovsk with Germany, although it was a huge cost to Russia.","['Bolsheviks', 'Treaty', 'BrestLitovsk', 'Germany', 'Russia']","['Germany', 'Russia']"
"In the treaty, Bolshevik Russia ceded the Baltic states to Germany, and its province of Kars Oblast in the South Caucasus to the Ottoman Empire .","['Bolshevik Russia', 'Baltic', 'Germany', 'Kars Oblast', 'the South Caucasus', 'the Ottoman Empire']",['Germany']
It also recognized the independence of Ukraine .  ,['Ukraine'],['Ukraine']
"Although Germany shifted huge forces from the eastern to the western front after signing the treaty, it was unable to stop the Allied advance, especially with the entrance of American troops in 1918.  ","['Germany', 'Allied', 'American', '1918']",['Germany']
"Germany, 1933 Fascism first appeared in Italy with the rise to power of Benito Mussolini in 1922.  ","['Germany', '1933', 'Italy', 'Benito Mussolini', '1922']","['Germany', 'Italy']"
"When Adolf Hitler came to power in Germany in 1933, a new variant of fascism called Nazism took over Germany and ended the German experiment with democracy.","['Adolf Hitler', 'Germany', '1933', 'Nazism', 'Germany', 'German']","['Germany', 'Germany']"
"The Nazi Party in Germany was dedicated to the restoration of German honor and prestige, the unification of Germanspeaking peoples, and the annexation of Central and Eastern Europe as vassal states, with the Slavic population to act as slave labor to serve German economic interests.  ","['The Nazi Party', 'Germany', 'German', 'Central and Eastern Europe', 'Slavic', 'German']",['Germany']
They could see nothing wrong with a strong Germany ready to take on the communist menace to the east.,['Germany'],['Germany']
"33  Hitler began to put his plan in motion, annexing Austria in the Anschluss , or reunification of Austria to Germany, in 1938.  ","['33', 'Hitler', 'Austria', 'Austria', 'Germany', '1938']","['Austria', 'Austria', 'Germany']"
37  Spain also became a dictatorship under the leadership of General Francisco Franco after the Spanish Civil War .  ,"['37', 'Spain', 'Francisco Franco', 'the Spanish Civil War']",['Spain']
"The signing of the MolotovRibbentrop Pact in Moscow, 23 August 1939 Soon after the events in Czechoslovakia, Britain and France issued assurances of protection to Poland, which seemed to be next on Hitlers list.","['the MolotovRibbentrop Pact', 'Moscow', '23 August 1939', 'Czechoslovakia', 'Britain', 'France', 'Poland']","['France', 'Poland']"
"World War II officially began on 1 September 1939, when Hitler unleashed his Blitzkrieg , or lightning war, against Poland.","['World War II', '1 September 1939', 'Hitler', 'Blitzkrieg', 'Poland']",['Poland']
"Britain and France, much to Hitlers surprise, immediately declared war upon Germany, but the help they delivered to Poland was negligible.  ","['Britain', 'France', 'Germany', 'Poland']","['France', 'Germany', 'Poland']"
"39  Sixteen days later, Poland was attacked from the East by Soviet Union, acting in a secret alliance with Nazi Germany.  ","['39  Sixteen days later', 'Poland', 'East', 'Soviet Union', 'Nazi Germany']",['Poland']
"As Hitlers forces conquered Poland, the Soviet Union , under General Secretary Joseph Stalin , was acting out guarantees of territory under a secret part of a nonaggression pact between the USSR and Germany known as the MolotovRibbentrop Pact .","['Poland', 'the Soviet Union', 'Joseph Stalin', 'USSR', 'Germany', 'the MolotovRibbentrop Pact']","['Poland', 'Germany']"
"This treaty gave Stalin free rein to take the Baltic republics of Estonia , Latvia, and Lithuania , as well as Eastern Poland, all of which would remain in Soviet possession after the war.  ","['Stalin', 'Baltic', 'Estonia', 'Latvia', 'Lithuania', 'Eastern Poland', 'Soviet']","['Estonia', 'Latvia', 'Lithuania']"
"42  Stalin also launched an attack on Finland, which he hoped to reduce to little more than a Soviet puppet state, but the Red Army met staunch Finnish resistance in what became known as the Winter War and succeeded in gaining only limited territory from the Finns.  ","['42', 'Stalin', 'Finland', 'Soviet', 'the Red Army', 'Finnish', 'the Winter War', 'Finns']",['Finland']
This action would later cause the Finns to ally with Germany when its attack on the Soviet Union came in 1941.  ,"['Finns', 'Germany', 'the Soviet Union', '1941']",['Germany']
"44  Blitzkrieg  edit  After the defeat of Poland, a period known as the Phony War ensued during the winter of 19391940, which saw only limited military land operation on the Western Front .  ","['44', 'Blitzkrieg', 'Poland', 'the Phony War', 'the winter of 19391940', 'the Western Front']",['Poland']
"45  This changed when Hitler occupied Denmark and Norway, beginning on 9 April 1940.","['45', 'Hitler', 'Denmark', 'Norway', '9 April 1940']","['Denmark', 'Norway']"
Norway was strategically important because of its sea routes which supplied crucial Swedish ore to the Nazi war machine.,"['Norway', 'Swedish', 'Nazi']",['Norway']
"Norway held on for a few crucial weeks, but Denmark surrendered after only six hours .  ","['Norway', 'a few crucial weeks', 'Denmark', 'only six hours']","['Norway', 'Denmark']"
"46   47  Sweden was the only Scandinavian country to successfully maintain its neutrality throughout the war, with occasional breaches of neutrality in favor of both Germany and the Western Allies .  ","['46', '47', 'Sweden', 'Scandinavian', 'Germany', 'the Western Allies']","['Sweden', 'Germany']"
"48  On the 10 May 1940, when the Germans launched a massive attack on the Low Countries Belgium, the Netherlands, and Luxembourg , likely to surmount the Maginot Line of defenses on the FrancoGerman border.  ","['48', 'May 1940', 'Germans', 'Netherlands', 'Luxembourg', 'the Maginot Line', 'FrancoGerman']","['Netherlands', 'Luxembourg']"
"The worst of this was that King Leopold III of Belgium surrendered to the Germans on 28 May without warning his allies, exposing the entire flank of the Allied forces to German panzer groups.  ","['King Leopold III', 'Belgium', 'Germans', '28 May', 'Allied', 'German']",['Belgium']
"50  With the disaster in the Low Countries, France, considered at the time to have had the finest army in the world, lasted only six weeks, with Paris being occupied on 14 June.","['50', 'France', 'only six weeks', 'Paris', '14 June']",['France']
"The debacle in France also led to one of the wars greatest mysteries, and Hitlers first great blunder, Dunkirk , where a third of a million trapped British and French soldiers were evacuated by not only British war boats, but every craft the army could find, including fishing boats.","['France', 'one', 'Dunkirk', 'a third', 'million', 'British', 'French', 'British']",['France']
"Hitler did not occupy all of France, but about threequarters, including all of the Atlantic coast, allowing Marshal Ptain to remain as dictator of an area known as Vichy France .  ","['Hitler', 'France', 'Atlantic', 'Vichy France']",['France']
"However, members of the escaped French Army formed around General Charles de Gaulle to create the Free French forces, which would continue to battle Hitler in the stead of an independent France.  ","['the escaped', 'French Army', 'Charles de Gaulle', 'French', 'Hitler', 'France']",['France']
"At this moment, Italy, under Benito Mussolini , declared war on the Allies on 10 June, thinking that the war was almost over, but he managed only to occupy a few hundred yards of French territory.  ","['Italy', 'Benito Mussolini', '10 June', 'a few hundred yards', 'French']",['Italy']
"55  Throughout the war, the Italians would be more of a burden to the Nazis than a boon, and would later cost them precious time in Greece.  ","['55', 'Italians', 'Nazis', 'Greece']",['Greece']
"The British at first suffered steady losses, but eventually managed to turn the air war against Germany, taking down 2,698 German planes throughout the summer of 1940 to only 915 Royal Air Force RAF losses.  ","['British', 'first', 'Germany', '2,698', 'German', 'the summer of 1940', '915', 'Royal Air Force', 'RAF']",['Germany']
"However, a proallied coup in Yugoslavia and Mussolinis almost utter defeat in his invasion of Greece from occupied Albania prompted Hitler to launch a personal campaign of revenge in Yugoslavia and to occupy Greece at the same time.  ","['Yugoslavia', 'Mussolinis', 'Greece', 'Albania', 'Hitler', 'Yugoslavia', 'Greece']","['Greece', 'Albania', 'Greece']"
"66  Throughout 1941, German forces, divided into 3 army groups Army Group A, Army Group B, and Army Group C, occupied the territories of the present day Ukraine and Belarus , laid siege to Leningrad present day Saint Petersburg, and advanced to within 15 miles of Moscow.","['66', '1941', 'German', '3', 'Army Group', 'Army Group', 'Army Group C', 'Ukraine', 'Belarus', 'Leningrad', 'Saint Petersburg', '15 miles', 'Moscow']","['Ukraine', 'Belarus']"
67  Mussolini had launched an offensive in North Africa from Italiancontrolled Libya into Britishcontrolled Egypt.,"['67', 'Mussolini', 'North Africa', 'Italiancontrolled', 'Libya', 'Britishcontrolled', 'Egypt']","['Libya', 'Egypt']"
"However, the British smashed the Italians and were on the verge of taking Libya.","['British', 'Italians', 'Libya']",['Libya']
68  Rommel managed to use his small force to repeatedly smash massively superior British forces and to recapture the port city of Tobruk and advance into Egypt .,"['68', 'Rommel', 'British', 'Tobruk', 'Egypt']",['Egypt']
"However, Hitler, embroiled in his invasion of the Soviet Union, refused to send Rommel any more troops, causing Rommel to retreat and preventing him from seizing the Middle East , where Axisfriendly regimes had taken root in Iraq and Persia presentday Iran .  ","['Hitler', 'the Soviet Union', 'Rommel', 'Rommel', 'the Middle East', 'Iraq', 'Persia', 'Iran']","['Iraq', 'Iran']"
"Parts of the German brass advised against declaring war on the US, arguing that since Japan was the aggressor, the Tripartite Pact didnt bind Germany to do so.","['German', 'US', 'Japan', 'the Tripartite Pact', 'Germany']","['Japan', 'Germany']"
"However, Hitler hoped that Japan would be able to quickly defeat the US and then turn its attention on helping the effort against Russia.","['Hitler', 'Japan', 'US', 'Russia']","['Japan', 'Russia']"
Both Germany and Italy declared war on the United States a few days after the attack.  ,"['Germany', 'Italy', 'the United States', 'a few days']","['Germany', 'Italy']"
"73  By this time, Rommel had been forced to abandon North Africa after a defeat by Montgomery at El Alamein in what was the first decisive victory of the Allies over the Germany army, leading Churchill to declare it  the end of the beginning .  ","['73', 'Rommel', 'North Africa', 'Montgomery', 'El Alamein', 'first', 'Germany', 'Churchill']",['Germany']
"They drove out the Germans in Africa, invading Morocco and Algeria on 8 November 1942.  ","['Germans', 'Africa', 'Morocco', 'Algeria', '8 November 1942']","['Morocco', 'Algeria']"
"Then, on 10 July 1943, the Allies invaded Sicily , in preparation for an advance through Italy, the soft underbelly of the Axis, as Winston Churchill called it.","['10 July 1943', 'Sicily', 'Italy', 'Axis', 'Winston Churchill']",['Italy']
"On 9 September, the invasion of Italy began.  ","['9 September', 'Italy']",['Italy']
"77  By the winter of 1943, the southern half of Italy was in Allied hands.","['77', 'the winter of 1943', 'half', 'Italy', 'Allied']",['Italy']
"On 8 September, the Italians formally surrendered,  78  but most of Italy not in Allied hands was controlled by German troops and those loyal to Mussolinis Mussolini had been freed by German paratroopers new Italian Social Republic , which in reality consisted of the shrinking zone of German control.","['8 September', 'Italians', '78', 'Italy', 'Allied', 'German', 'Mussolinis Mussolini', 'German', 'Italian Social Republic', 'German']",['Italy']
"Rommel, who was now in charge of defending France against possible Allied attack, thought the Allies would not attack during the stormy weather, and was on holiday in Germany.  ","['Rommel', 'France', 'Allied', 'Germany']","['France', 'Germany']"
"By this time, the war was looking ever darker for Germany.",['Germany'],['Germany']
85  In France,"['85', 'France']",['France']
"The west went to Britain, France, and the U.S. Postwar Germany would be split between the four, as would Berlin.","['Britain', 'France', 'the U.S. Postwar Germany', 'four', 'Berlin']",['France']
"The Soviets launched a devastating attack from Poland into Germany and Eastern Europe, intending to take Berlin.","['Soviets', 'Poland', 'Germany', 'Eastern Europe', 'Berlin']","['Poland', 'Germany']"
"The Germans collapsed in the West, allowing the Allies to fan out across Germany.","['Germans', 'West', 'Germany']",['Germany']
"However, the Supreme Allied Commander, American general Dwight D. Eisenhower , refused to strike for Berlin, and instead became obsessed with reports of possible guerrilla activity in southern Germany, which in reality existed mainly in the propaganda of Joseph Goebbels.  ","['the Supreme Allied Commander', 'American', 'Dwight D. Eisenhower', 'Berlin', 'Germany', 'Joseph Goebbels']",['Germany']
94  Japan then used this as pretext to invade northeastern China the next day and turn the region of Manchuria into the Japanese puppet state of Manchukuo .  ,"['94', 'Japan', 'China', 'the next day', 'Manchuria', 'Japanese', 'Manchukuo']",['Japan']
"After the League of Nations commissioned the 1932 Lytton Report , which exposed the Mukden Incident as a Japanese ruse, Japan was left internationally isolated, withdrawing from the League of Nations in March 1933.","['the League of Nations', '1932', 'Lytton Report', 'the Mukden Incident', 'Japanese', 'Japan', 'the League of Nations', 'March 1933']",['Japan']
"In 1934 Manchukuo became a constitutional monarchy and the former Chinese Emperor Pu Yi was placed on the throne, despite the real power being held by Japan.  ","['1934', 'Manchukuo', 'Chinese', 'Pu Yi', 'Japan']",['Japan']
"96  Despite relations between Japan and China suffering because the occupation of Manchuria, the situation did not turn into allout war until 7 July 1937, when a dispute between Chinese and Japanese soldiers turned into a battle during the Marco Polo Bridge Incident .  ","['96', 'Japan', 'China', 'Manchuria', '7 July 1937', 'Chinese', 'Japanese', 'the Marco Polo Bridge Incident']",['Japan']
"98  Japan enjoyed some early major victories, capturing both Shanghai and the Chinese capital of Nanjing in 1937 and forcing the Chinese central government s relocation to Chongqing .","['98', 'Japan', 'Shanghai', 'Chinese', 'Nanjing', '1937', 'Chinese', 'Chongqing']",['Japan']
"Following Chinese victories in Changsha and Guangxi in 1939, the war reached somewhat of a stalemate, with Japan controlling the large cities, but being unable to rule the vast countryside.  ","['Chinese', 'Changsha', 'Guangxi', '1939', 'Japan']",['Japan']
"99  On 27 September 1940, Japan became cosignatories of the Tripartite Pact , joining a military alliance with Germany and Italy.  ","['99', '27 September 1940', 'Japan', 'the Tripartite Pact', 'Germany', 'Italy']","['Japan', 'Germany', 'Italy']"
"100  Japanese Expansion  edit  USS West Virginia during the attack on Pearl Harbor On 7 December 1941, Japan launched a surprise attack on the American base at Pearl Harbor as a mean of preventing the U.S. Pacific Fleet from interfering with its planned expansion in the area.  ","['100  ', 'Japanese', 'USS West Virginia', 'Pearl Harbor', '7 December 1941', 'Japan', 'American', 'Pearl Harbor', 'the U.S. Pacific Fleet']",['Japan']
"The next day, following Roosevelts Infamy Speech , the United States declared war on Japan, marking the official entry of both nations in World War 2.  102   103  At the same time, Japan also launched attacks on Thailand , the British colonies of Malaya , Singapore , Hong Kong and American military bases in Guam , Wake Island and the Philippines .  ","['next day', 'Roosevelts Infamy Speech', 'the United States', 'Japan', 'World War 2', '102', '103', 'Japan', 'Thailand', 'British', 'Malaya', 'Singapore', 'Hong Kong', 'American', 'Guam', 'Wake Island', 'Philippines']","['Japan', 'Japan', 'Thailand', 'Singapore', 'Philippines']"
"Japan managed to capture British Burma , New Guinea , the Dutch East Indies , the Solomon Islands , Bali and Timor .  ","['Japan', 'British Burma', 'New Guinea', 'the Dutch East Indies', 'the Solomon Islands', 'Bali', 'Timor']",['Japan']
"105  In March 1942, days before the surrender of the Philippines, general Douglas MacArthur, who came out of retirement to become commander of United States Army Forces in the Far East at the onset of the war, was forced to flee and narrowly escape to Australia.  ","['105', 'March 1942, days', 'Philippines', 'Douglas MacArthur', 'United States Army Forces', 'the Far East', 'Australia']","['Philippines', 'Australia']"
"106  On 19 February 1942, Japan also launched a devastating aerial attack on the Australian city of Darwin, in what was the first attack by a foreign power on Australian soil.  ","['106', '19 February 1942', 'Japan', 'Australian', 'Darwin', 'first', 'Australian']",['Japan']
"The losses suffered during this Battle of Midway, paired with the campaign of attrition that was taking place in Solomon Islands , left Japan unable to replenish its forces and turned the tides of war against it.","['this Battle of Midway', 'Solomon Islands', 'Japan']","['Solomon Islands', 'Japan']"
"111  Allied offensive  edit  A map of the Japanese advance from 1937 to 1942 Over the next two years the Allies slowly captured one island base after another, trying to get closer to Japan itself, where it planned to launch massive strategic air attacks and, only if absolutely necessary, execute a ground invasion.","['111', 'Allied', 'Japanese', '1937 to 1942', 'the next two years', 'Allies', 'one', 'Japan']",['Japan']
"By July 1944, the US recaptured Guam and captured Tinian , which finally put them in attacking range of mainland Japan using the new Boeing B29 bombers.  ","['July 1944', 'US', 'Guam', 'Tinian', 'Japan', 'Boeing B29']",['Japan']
"Despite the advances of the Allies, massive fighting was still taking place, both in SouthEast Asia with the Japanese offensive in India and in the Pacific, with the Battle of the Philippine Sea , where Japan suffered major losses and definitively lost the ability to rely on aircraft carriers .  ","['SouthEast Asia', 'Japanese', 'India', 'Pacific', 'the Battle of the Philippine Sea', 'Japan']","['India', 'Japan']"
"Capturing the island meant not only a better launch station for aerial attacks against mainland Japan, but also the prevention of its use as an earlywarning station against air raids.",['Japan'],['Japan']
"119  With Japan struggling to defend the homeland islands, counteroffensives in other parts of the Japanese Empire became more feasible, with important battles taking place in Burma , Borneo and China .","['119', 'Japan', 'the Japanese Empire', 'Burma', 'Borneo', 'China']",['Japan']
"Final days  edit  The assaults on both Iwo Jima and Okinawa proved incredibly costly in terms of American lives and president Truman was horrified at the prospect of Operation Downfall, a planned bootsontheground invasion of mainland Japan that was estimated to lead to over a million casualties among American soldiers.  ","['days', 'Iwo Jima', 'Okinawa', 'American', 'Truman', 'Operation Downfall', 'Japan', 'over a million', 'American']",['Japan']
"Following the Potsdam Declaration of 26 July, where the Allies threatened prompt and utter destruction should Japan not surrender,  124  the decision was made to resort to the first use of atomic bombs .","['the Potsdam Declaration', '26 July', 'Allies', 'Japan', '124', 'first']",['Japan']
"After the conquest of Poland, the Third Reich , which had previously deported Jews and other undesirables, suddenly had within its borders the largest concentration of Jews in the world.","['Poland', 'Jews', 'Jews']",['Poland']
"135  The Nazis created a system of extermination camps throughout Poland, and began rounding up Jews from the Soviet Union, and from the Ghettos.  ","['135', 'Nazis', 'Poland', 'Jews', 'the Soviet Union', 'Ghettos']",['Poland']
"136   137  Not only were Jews shot or gassed to death en masse, but they were forced to provide slave labor and they were used in horrific medical experiments see Human experimentation in Nazi Germany .  ","['136', '137', 'Jews', 'Nazi', 'Germany']",['Germany']
"However, Germany had surrendered in May 1945, and it had been discovered that the German atomic bomb program had not been very close to success.  ","['Germany', 'May 1945', 'German']",['Germany']
This new weapon was alone over 400 times as powerful as the weapons used against Japan.,"['over 400', 'Japan']",['Japan']
"Eventually, nine nations would overtly develop nuclear weapons, and still maintain stockpiles today the United States , the Soviet Union and later Russia would inherit these, the United Kingdom , France , China , India , Pakistan , Israel and North Korea .  ","['nine', 'today', 'the United States', 'the Soviet Union', 'Russia', 'the United Kingdom', 'France', 'China', 'India', 'Pakistan', 'Israel', 'North Korea']","['Russia', 'France', 'India', 'Pakistan', 'Israel']"
"159  South Africa developed six crude weapons in the 1980s which it later dismantled,  160  and Israel almost certainly developed nuclear weapons though it never confirmed nor denied it.  ","['159', 'South Africa', 'six', 'the 1980s', '160', 'Israel']","['South Africa', 'Israel']"
"161  The creation of the Nuclear Nonproliferation Treaty in 1968 was an attempt to curtail such proliferation,  162  but a number of countries developed nuclear weapons since it was signed and many did not sign it, and several other countries, including Libya and Iran were suspected of having clandestine nuclear weapons programs.  ","['161', 'the Nuclear Nonproliferation Treaty', '1968', '162', 'Libya', 'Iran']","['Libya', 'Iran']"
"Germany, chief instigator of the war, was placed under joint military occupation by the United States, Great Britain, France, and the Soviet Union.","['Germany', 'the United States', 'Great Britain', 'France', 'the Soviet Union']","['Germany', 'France']"
"Japan was also placed under U.S. occupation, that would last seven years, until 1952.  ","['Japan', 'U.S.', 'last seven years', '1952']",['Japan']
"168  Oddly, these two Axis powers, despite military occupation, soon rose to become the second Japan and third West Germany most powerful economies in the world.  ","['two', 'second', 'Japan', 'third', 'West Germany']",['Japan']
"The end of empires decolonization  edit  Michael Somare , the first leader of an independent Papua New Guinea .","['Michael Somare', 'first', 'Papua New Guinea']",['Papua New Guinea']
"In India, Mahatma Gandhi became a global icon for his nonviolent struggle to achieve Indian independence whereas Mohamed Ali Jinnah advocated for the independence of a separate state for Muslims.","['India', 'Mahatma Gandhi', 'Indian', 'Mohamed Ali Jinnah', 'Muslims']",['India']
"This was achieved in 1947 with the end of British rule in India and the Partition of the territory into modernday India and Pakistan , which would later also further divide, leading to the creation of the Peoples Republic of Bangladesh in 1971.  ","['1947', 'British', 'India', 'the Partition of the', 'India', 'Pakistan', 'the Peoples Republic of Bangladesh', '1971']","['India', 'India', 'Pakistan']"
"175   176  Elsewhere in Asia, The United States granted independence to the Philippines , its major Pacific possession in 1946.  ","['175', '176', 'Asia', 'The United States', 'Philippines', 'Pacific', '1946']",['Philippines']
"177  In French Indochina , armed insurrections forced the French out in the early 1950s, leading to the formation of Laos , Cambodia and Vietnam .  ","['177', 'French', 'Indochina', 'French', 'the early 1950s', 'Laos', 'Cambodia', 'Vietnam']","['Laos', 'Cambodia', 'Vietnam']"
", nationalists such as Jomo Kenyatta of Kenya and Kwame Nkrumah of Ghana led their respective nations to independence from foreign rule.  ","['Jomo Kenyatta', 'Kenya', 'Kwame Nkrumah', 'Ghana']","['Kenya', 'Ghana']"
"179  Mere decades before, the British Empire controlled almost half of the continent, but by 1968, the only British possession in Africa was Seychelles which would also become independent in 1976.","['179  Mere decades', 'British Empire', 'almost half', '1968', 'British', 'Africa', 'Seychelles', '1976']",['Seychelles']
"Between 1956 and 1962, almost 20 African countries achieved their independence from France.  ","['Between 1956 and 1962', 'almost 20', 'African', 'France']",['France']
